work_id,work_title,work_source,work_authors,referenced_work_ids,referenced_titles,referenced_sources,referenced_authors
w4306292106,"ai-big data analytics for building automation and management systems: a survey, actual challenges and future perspectives",artificial intelligence review,"yassine himeur, mariam elnour, fodil fadli, nader meskin, ioan petri, yacine rezgui, fayçal bensaali, abbes amira","w1209078686, w1520597531, w1954223889","autonomous hvac control, a reinforcement learning approach, safety considerations in the chemical process industries, emergency response in complex buildings: automated selection of safest and balanced routes","lecture notes in computer science, springer ebooks, computer-aided civil and infrastructure engineering","enda barrett, s.p. linder, stanley m. englund, vadim zverovich, lamine mahdjoubi, paweł bogusławski, fodil fadli, hichem barki"
w4306786778,deep multiagent reinforcement learning: challenges and directions,artificial intelligence review,"annie wong, thomas bäck, anna v. kononova, aske plaat","w107583932, w1192553058, w1528459956","on the sample complexity of reinforcement learning, evolutionary dynamics of multi-agent learning: a survey, helping behavior and altruism: an empirical and conceptual overview","doctoral thesis, ucl (university college london)., journal of artificial intelligence research, advances in experimental social psychology","sham m. kakade, daan bloembergen, karl tuyls, daniel hennes, michael kaisers, john f. dovidio"
w4307129239,self-dependence multi-label learning with double k for missing labels,artificial intelligence review,"kun qian, xue-yang min, yusheng cheng, guojie song, fan min","w1589362500, w1638081485, w1969954882","scene classification via plsa, measuring statistical dependence with hilbert-schmidt norms, learning low-rank label correlations for multi-label classification with missing labels","lecture notes in computer science, lecture notes in computer science, source not found","anna bosch, andrew zisserman, xavier muñoz, arthur gretton, olivier bousquet, alex smola, bernhard schölkopf, linli xu, zhen wang, zefan shen, yubo wang, enhong chen"
w4307243336,a survey of designing convolutional neural network using evolutionary algorithms,artificial intelligence review,"vidyanand mishra, lalit kane","w1034159276, w1486140585, w1536680647","towards dropout training for convolutional neural networks, meta-heuristics: advances and trends in local search paradigms for optimization, fast r-cnn","neural networks, springer ebooks, source not found","haibing wu, xiaodong gu, stefan voß, ibrahim h. osman, catherine roucairol, ross girshick"
w4307321238,"short text topic modelling approaches in the context of big data: taxonomy, survey, and analysis",artificial intelligence review,"belal abdullah hezam murshed, m suresha, jemal abawajy, mufeed ahmed naji saif, hasib daowd esmail al-ariki, hudhaifa mohammed abdulwahab","w1512012700, w1590495275, w1714665356","dynamic topic‐related tweet retrieval, predicting elections with twitter: what 140 characters reveal about political sentiment, a biterm topic model for short texts","journal of the association for information science and technology, proceedings of the international aaai conference on web and social media, source not found","juan m. cotelo, fermín l. cruz, josé a. troyano, andranik tumasjan, timm o. sprenger, philipp sandner, isabell m. welpe, xiaohui yan, jiafeng guo, yanyan lan, xueqi cheng"
w4307572272,explainable ai for clinical and remote health applications: a survey on tabular and time series data,artificial intelligence review,"flavio di martino, franca delmastro","w1559125062, w1678356000, w1849277567","a step towards the automated diagnosis of parkinson's disease: analyzing handwriting movements, greedy function approximation: a gradient boosting machine., visualizing and understanding convolutional networks","source not found, the annals of statistics, lecture notes in computer science","clayton r. pereira, danillo roberto pereira, francisco a. da silva, christian hook, silke anna theresa weber, luís a. m. pereira, joão paulo papa, jerome h. friedman, matthew d. zeiler, rob fergus"
w4307819182,video restoration based on deep learning: a comprehensive survey,artificial intelligence review,"claudio rota, marco buzzelli, simone bianco, raimondo schettini","w1522734439, w1951289974, w1965221572","learning spatiotemporal features with 3d convolutional networks, epicflow: edge-preserving interpolation of correspondences for optical flow, video denoising, deblocking, and enhancement through separable 4-d nonlocal spatiotemporal transforms","source not found, source not found, ieee transactions on image processing","du tran, lubomir bourdev, rob fergus, lorenzo torresani, manohar paluri, jérôme revaud, philippe weinzaepfel, zaïd harchaoui, cordelia schmid, matteo maggioni, giacomo boracchi, alessandro foi, karen egiazarian"
w4307910037,construction of multivalued cryptographic boolean function using recurrent neural network and its application in image encryption scheme,artificial intelligence review,"nabilah abughazalah, asim latif, hafiz muhammad waseem, majid khan, ammar s. alanazi, iqtadar hussain","w162464270, w1970984047, w1973782209","picaro – a block cipher allowing efficient higher-order side-channel resistance, a general hybrid model for chaos robust synchronization and degradation reduction, color image encryption based on one-time keys and robust chaotic maps","lecture notes in computer science, information sciences, computers & mathematics with applications","gilles piret, thomas roche, claude carlet, ya shuang deng, hanping hu, naixue xiong, wei xiong, lingfeng liu, hongjun liu, xingyuan wang"
w4307911024,tutorial on pca and approximate pca and approximate kernel pca,artificial intelligence review,sanparith marukatat,"w1510073064, w1515999713, w1560724230","kernel methods for pattern analysis, histogram intersection kernel for image classification, learning with kernels","source not found, source not found, source not found","john shawe‐taylor, nello cristianini, annalisa barla, francesca odone, alessandro verri, bernhard schölkopf, alexander j. smola"
w4307913127,lt-smf: long term stock market price trend prediction using optimal hybrid machine learning technique,artificial intelligence review,"k. venkateswararao, b. venkata ramana reddy","w2260992041, w2804968338, w2900059062","enhancement of stock market forecasting using an improved fundamental analysis-based approach, aggregating multiple types of complex data in stock market prediction: a model-independent framework, overconfidence and disposition effect in the stock market: a micro world based setting","soft computing, knowledge-based systems, journal of behavioral and experimental finance","yuh-jen chen, yuh-min chen, chang lin lu, huiwen wang, shan lu, jichang zhao, cristian trejos, adrian van deemen, yeny e. rodríguez, juan miguel gómez"
w4308112317,quantum-inspired metaheuristic algorithms: comprehensive survey and classification,artificial intelligence review,farhad soleimanian gharehchopogh,"w1497256448, w1523444863, w1546572085","adaptation in natural and artificial systems, membrane-inspired quantum bee colony optimization and its applications for decision engine, quantum-inspired genetic algorithms for flow shop scheduling","source not found, journal of central south university, studies in computational intelligence","john h. holland, hongyuan gao, chenwan li, ling wang, binbin li"
w4308112567,a survey on ensemble learning under the era of deep learning,artificial intelligence review,"yongquan yang, haijun lv, ning chen","w1498436455, w1499586235, w1534477342","learning representations by back-propagating errors, identifying ad-sensitive and cognition-relevant imaging biomarkers via joint classification and regression, ensemble methods in machine learning","nature, lecture notes in computer science, lecture notes in computer science","david e. rumelhart, geoffrey e. hinton, ronald j. williams, hua wang, feiping nie, heng huang, shannon l. risacher, andrew j. saykin, li shen, thomas g. dietterich"
w4308160155,artificial intelligence for suicide assessment using audiovisual cues: a review,artificial intelligence review,"sahraoui dhelim, liming chen, huansheng ning, chris nugent","w1602667774, w1970261863, w1976066595","a review of glottal waveform analysis, are lgbt populations at a higher risk for suicidal behaviors in australia? research findings and implications, avec 2013","springer ebooks, journal of homosexuality, source not found","jacqueline walker, peter murphy, delaney michael skerrett, kairi kõlves, diego de leo, michel valstar, björn schüller, kirsty smith, florian eyben, bihan jiang, sanjay bilakhia, sebastian schnieder, roddy cowie, maja pantić"
w4308381112,algorithmic trading with directional changes,artificial intelligence review,"adesola adegboye, michael kampouridis, fernando e. b. otero","w1659842140, w1981578880, w1982553641","adaptation in natural and artificial systems, pso based time series models applied in exchange rate forecasting for business performance management, working with opencl to speed up a genetic programming financial forecasting algorithm","source not found, electronic commerce research, source not found","john h. holland, jui-fang chang, yueh‐min huang, james brookhouse, fernando e. b. otero, michael kampouridis"
w4308607522,a quantitative and qualitative hybrid attributes based imbalanced group conflict analysis method and its application to evaluation of clinical therapeutic effect,artificial intelligence review,"xiaoli chu, bingzhen sun, xiaodong chu, yan zhang, qingchun huang, jianxiong cai","w1992359248, w1999849541, w2002250581","grey-based preference in a graph model for conflict resolution with multiple decision makers, safety and efficacy of combination therapy of iguratimod with methotrexate for patients with active rheumatoid arthritis with an inadequate response to methotrexate: an open-label extension of a randomized, double-blind, placebo-controlled trial, rough set approach to multiple criteria classification with imprecise evaluations and assignments","ieee transactions on systems man and cybernetics systems, modern rheumatology, european journal of operational research","hanbin kuang, ma bashar, keith w. hipel, d. marc kilgour, masako hara, naoki ishiguro, kou katayama, masakazu kondo, takayuki sumida, tsuneyo mimori, satoshi soen, kota nagai, tomonobu yamaguchi, kazuhiko yamamoto, krzysztof dembczyński, salvatore greco, roman słowiński"
w4308750008,smart farming prediction models for precision agriculture: a comprehensive survey,artificial intelligence review,"dekera kenneth kwaghtyo, christopher ifeanyi eke","w1776176641, w2014847057, w2026882991","oracon: an adaptive model for context prediction, estimating crop yields with deep learning and remotely sensed data, automated zone-specific irrigation with wireless sensor/actuator network and adaptable decision support","expert systems with applications, source not found, computers and electronics in agriculture","joão rosa, jorge luís victória barbosa, giovane d. ribeiro, kentaro kuwata, ryosuke shibasaki, christos goumopoulos, brendan o’flynn, achilles kameas"
w4308840623,conventional and contemporary approaches used in text to speech synthesis: a review,artificial intelligence review,"navdeep kaur, parminder singh","w1492383498, w1525304189, w1569145343","multi-speaker modeling and speaker adaptation for dnn-based tts synthesis, a taiwanese text-to-speech system with applications to language learning, modeling of speech parameter sequence considering global variance for hmm-based speech synthesis","source not found, source not found, intech ebooks","yuchen fan, yao qian, frank k. soong, lei he, min-siong liang, rhuei-cheng yang, yuang-chin chiang, dau-cheng lyu, ren-yuan lyu, tomoki toda"
w4308840632,new constructions of decision evaluation functions in three-way decision spaces based on uninorms,artificial intelligence review,"zihang jia, junsheng qiao","w130507663, w1521729143, w1883715000","rough sets and current trends in computing, on the choice of the pair conjunction–implication into the fuzzy morphological edge detector, three-way decision spaces based on partially ordered sets and three-way decisions based on hesitant fuzzy sets","lecture notes in computer science, ieee transactions on fuzzy systems, knowledge-based systems","jen‐chih yao, yanyan yang, roman słowiński, salvatore greco, huaxiong li, sushanta k. mitra, lech polkowski, manuel gonzález-hidalgo, sebastià massanet, arnau mir, daniel ruiz-aguilera, bao qing hu"
w4308861918,a survey on syntactic processing techniques,artificial intelligence review,"xulang zhang, rui mao, erik cambria","w116785612, w1512098439, w1515847863","the prague dependency treebank, fast training of support vector machines using sequential minimal optimization, part-of-speech tagging from 97% to 100%: is it time for some linguistics?","text, speech and language technology, the mit press ebooks, lecture notes in computer science","alena böhmová, jan hajič, eva hajičová, barbora hladká, john platt, christopher d. manning"
w4309198707,application of machine learning methods in fault detection and classification of power transmission lines: a survey,artificial intelligence review,"fatemeh mohammadi shakiba, s. mohsen azizi, mengchu zhou, abdullah abusorrah","w1034244119, w1197176562, w1547549286","an anfis-based fault classification approach in double-circuit transmission line using current samples, novel filter based ann approach for short-circuit faults detection, classification and location in power transmission lines, anfis based time series prediction method of bank cash flow optimized by adaptive population activity pso algorithm","lecture notes in computer science, international journal of electrical power & energy systems, information","mohammad amin jarrahi, haidar samet, hossein raayatpisheh, ahmad jafari, mohsen rakhshan, hassan fathabadi, jie-sheng wang, chen-xu ning"
w4309349667,image denoising in the deep learning era,artificial intelligence review,"saeed izadi, darren sutton, ghassan hamarneh","w1514248469, w1791560514, w1829781029","introduction to inverse problems in imaging, on single image scale-up using sparse-representations, boosting of image denoising algorithms","source not found, lecture notes in computer science, siam journal on imaging sciences","m. bertero, patrizia boccacci, roman zeyde, michael elad, matan protter, yaniv romano, michael elad"
w4309490745,deep learning in drug discovery: an integrative review and future challenges,artificial intelligence review,"heba askr, enas elgeldawi, heba aboul ella, yaseen a.m.m. elshaier, mamdouh m. gomaa, aboul ella hassanien","w1524926404, w1568929544, w1648931199","data mining techniques in pharmacovigilance: analysis of the publicly accessible fda adverse event reporting system (aers), deep convolutional neural networks for annotating gene expression patterns in the mouse brain, handling cold start problem in recommender systems by using interaction based social proximity factor","intech ebooks, bmc bioinformatics, source not found","elisabetta poluzzi, emanuel raschi, carlo piccinni, fabrizio de, tao zeng, rongjian li, ravi mukkamala, jieping ye, shuiwang ji, punam bedi, chhavi sharma, pooja vashisth, deepika goel, muskan dhanda"
w4309582920,detecting persian speaker-independent voice commands based on lstm and ontology in communicating with the smart home appliances,artificial intelligence review,"leila safarpoor kalkhoran, shima tabibian, elaheh homayounvala","w1554101796, w1596411884, w1976395846","towards a seamless human interaction in iot, wake-up-word speech recognition, ontology description of smart home appliance based on semantic web","source not found, intech ebooks, source not found","eugenio rubio-drosdov, daniel díaz-sánchez, patricia arias-cabarcos, florina almenárez, andrés marín, veton këpuska, yuwei zhnag, zhiqiang wei, yongquan yang, chao song"
w4309643846,a multi-spectral palmprint fuzzy commitment based on deep hashing code with discriminative bit selection,artificial intelligence review,"tengfei wu, lu leng, muhammad khurram khan","w1490122681, w1584467222, w18523324","cancelable biometrics: a review, biometric template protection: bridging the performance gap between theory and practice, discriminant spectral hashing for compact palmprint representation","ieee signal processing magazine, ieee signal processing magazine, lecture notes in computer science","vishal m. patel, nalini ratha, rama chellappa, karthik nandakumar, anil k. jain, ying-cong chen, meng-hui lim, pong c. yuen, jian-huang lai"
w4309648563,a survey on binary metaheuristic algorithms and their engineering applications,artificial intelligence review,"jeng‐shyang pan, pei hu, václav snåšel, shu‐chuan chu","w1132038451, w1158789509, w1412975512","data-driven input variable selection for rainfall–runoff modeling using binary-coded particle swarm optimization and extreme learning machines, simultaneous feature selection and weighting – an evolutionary multi-objective optimization approach, neural network river forecasting through baseflow separation and binary-coded swarm optimization","journal of hydrology, pattern recognition letters, journal of hydrology","riccardo taormina, kwok‐wing chau, sujoy paul, swagatam das, riccardo taormina, kwok‐wing chau, bellie sivakumar"
w4309782696,three-way conflict analysis based on interval-valued pythagorean fuzzy sets and prospect theory,artificial intelligence review,"tianxing wang, libo zhang, bing huang, xianzhong zhou","w1498033560, w1668569279, w1765570948","extension of the topsis method based on prospect theory and trapezoidal intuitionistic fuzzy numbers for group decision making, pythagorean membership grades, complex numbers, and decision making, fundamental properties of interval-valued pythagorean fuzzy aggregation operators","journal of systems science and systems engineering, international journal of intelligent systems, international journal of intelligent systems","xihua li, xiaohong chen, ronald r. yager, ali m. abbasov, xindong peng, yong yang"
w4309796907,"a survey of graph neural networks in various learning paradigms: methods, applications, and challenges",artificial intelligence review,"lilapati waikhom, ripon patgiri","w1888005072, w1966382373, w1991418309","line, building a test collection for complex document information processing, inferring networks of substitutable and complementary products","source not found, source not found, source not found","jian tang, meng qu, wang ming-zhe, ming zhang, jun yan, qiaozhu mei, david lewis, gady agam, shlomo argamon, ophir frieder, d. grossman, jefferson heard, julian mcauley, rahul pandey, jure leskovec"
w4309796916,a new hyper-heuristic based on ant lion optimizer and tabu search algorithm for replica management in cloud environment,artificial intelligence review,"behnam mohammad hasani zade, n. mansouri, mohammad masoud javidi","w1481992000, w1963634469, w1970360069","chaotic sequences for secure cdma, magnetic charged system search: a new meta-heuristic algorithm for optimization, a threshold-based dynamic data replication and parallel job scheduling strategy to enhance data grid","arxiv (cornell university), acta mechanica, cluster computing","madhekar suneel, a. kaveh, mohammad ali motie share, m. moslehi, n. mansouri"
w4309822222,hardware implementation of slam algorithms: a survey on implementation approaches and platforms,artificial intelligence review,"reza eyvazpour, maryam shoaran, ghader karimian","w1484387568, w1491719799, w1530919911","introduction to autonomous mobile robots, brief: binary robust independent elementary features, autonomous, vision‐based flight and live dense 3d mapping with a quadrotor micro aerial vehicle","choice reviews online, lecture notes in computer science, journal of field robotics","roland siegwart, illah nourbakhsh, davide scaramuzza, michael calonder, vincent lepetit, christoph strecha, pascal fua, matthias faessler, flavio fontana, christian förster, elias mueggler, matia pizzoli, davide scaramuzza"
w4309867695,"an introduction to grey causal modelling (gcm): applications to manufacturing, supply chains, resilience, and sustainability",artificial intelligence review,r. rajesh,"w1908921387, w1940725707, w1967255951","introduction to grey systems theory, linkage between knowledge management and manufacturing performance: a structural equation modeling approach, an introduction to the application of interpretive structural modeling","understanding complex systems, journal of knowledge management, proceedings of the ieee","sifeng liu, yi lin, li pin tan, kuan yew wong, david malone"
w4309889602,chaotic electromagnetic field optimization,artificial intelligence review,"abdelmonem m. ibrahim, mohamed a. tawhid","w1778495026, w1970442252, w1973997930","a new hybrid algorithm based on chaotic maps for solving systems of nonlinear equations, synchronization in chaotic systems, firefly algorithm with chaos","chaos solitons & fractals, physical review letters, communications in nonlinear science and numerical simulation","javad alikhani koupaei, m.m. hosseini, louis m. pecora, thomas l. carroll, amir h. gandomi, xin‐she yang, siamak talatahari, amir h. alavi"
w4309913730,automatic targetless lidar–camera calibration: a survey,artificial intelligence review,"xingchen li, yuxuan xiao, beibei wang, haojie ren, yanyong zhang, jianmin ji","w107589915, w1506662060, w1575087183","automatic fusion of digital images and laser scanner data for heritage preservation, automatic fusion of hyperspectral images and laser scans using feature points, motion-based calibration of multimodal sensor arrays","lecture notes in computer science, journal of sensors, source not found","wassim moussa, mohammed abdelwahab, dieter fritsch, xiao zhang, aiwu zhang, xiang‐gao meng, zachary taylor, juan nieto"
w4309925307,combining neural computation and genetic programming for observational causality detection and causal modelling,artificial intelligence review,"a. murari, riccardo rossi, m. gelfusa","w1524313545, w1975062332, w1979769287","causal networks: semantics and expressiveness* *this work was partially supported by the national science foundation grant #iri-8610155. “graphoids: a computer representation for dependencies and relevance in automated reasoning (computer information science).”, an algorithm for fast recovery of sparse causal graphs, distilling free-form natural laws from experimental data","machine intelligence and pattern recognition, social science computer review, science","thomas verma, judea pearl, peter spirtes, clark glymour, michael schmidt, hod lipson"
w4309928656,knowledge representation and reasoning using fuzzy petri nets: a literature review and bibliometric analysis,artificial intelligence review,"ya-xuan yu, huaping gong, hu‐chen liu, xun mou","w1796841285, w1970137430, w1992910624","a novel blood pressure verification system for home care, sequential control algorithm in the form of fuzzy interpreted petri net, reliability apportionment approach for spacecraft solar array using fuzzy reasoning petri net and fuzzy comprehensive evaluation","computer standards & interfaces, ieee transactions on systems man and cybernetics systems, acta astronautica","victor r.l. shen, yuying wang, li-ya yu, l. gniewek, jianing wu, shaoze yan, liyang xie, peng gao"
w4309937154,a three-way decision method with tolerance dominance relations in decision information systems,artificial intelligence review,"wenjie wang, jianming zhan, weiping ding, shu‐ping wan","w1202774346, w1837010930, w1923896538","dominance-based rough set approach: an application case study for setting speed limits for vehicles in speed controlled zones, a novel approach for ranking in interval-valued information systems, dominance-based rough set approach for group decisions","knowledge-based systems, journal of intelligent & fuzzy systems, european journal of operational research","maria grazia augeri, paola cozzo, salvatore greco, bin xie, leijun li, ju‐sheng mi, salem chakhar, alessio ishizaka, ashraf labib, inès saad"
w4310193546,a consistency and consensus-driven approach for granulating linguistic information in gdm with distributed linguistic preference relations,artificial intelligence review,"han su, qi wu, xiaoan tang, ting huang","w138055454, w1859314164, w1876410369","fuzzy preference relations in group decision making, a comprehensive survey on particle swarm optimization algorithm and its applications, dominance-based rough set approach to decision involving multiple decision makers","lecture notes in economics and mathematical systems, mathematical problems in engineering, lecture notes in computer science","tetsuzo tanino, yudong zhang, shuihua wang‎, genlin ji, salvatore greco, benedetto matarazzo, roman słowiński"
w4310193697,a novel prospect-theory-based three-way decision methodology in multi-scale information systems,artificial intelligence review,"jiang deng, jianming zhan, weiping ding, пэйдэ лю, witold pedrycz","w1992915331, w2019025561, w2038166912","theory and applications of granular labelled partitions in multi-scale decision tables, the utility analysis of choices involving risk, ranking irregularities when evaluating alternatives by using some electre methods","information sciences, journal of political economy, omega","wei-zhi wu, yee leung, milton friedman, leonard j. savage, xiaoting wang, evangelos triantaphyllou"
