work_id,work_title,work_source,work_authors,referenced_work_ids,referenced_titles,referenced_sources,referenced_authors
w4366983521,a survey of fractional calculus applications in artificial neural networks,artificial intelligence review,"manisha joshi, s. r. bhosale, vishwesh a. vyawahare","w1062750781, w114527607, w1149035429","stability analysis of fractional-order hopfield neural networks with discontinuous activation functions, fractional calculus for scientists and engineers, hybrid projective synchronization of fractional-order memristor-based neural networks with time delays","neurocomputing, lecture notes in electrical engineering, nonlinear dynamics","shuo zhang, yongguang yu, qing wang, manuel duarte ortigueira, g. velmurugan, r. rakkiyappan"
w4367040485,"forty years of color quantization: a modern, algorithmic survey",artificial intelligence review,m. emre celebi,"w1134521401, w133638540, w1490454746","colour quantization with ant-tree, mapping rgb triples onto 16 distinct values, feature discovery by competitive learning*","applied soft computing, elsevier ebooks, cognitive science","maría luisa pérez delgado, alan w. paeth, david e. rumelhart, david zipser"
w4367299072,"machine learning and deep learning techniques for the analysis of heart disease: a systematic literature review, open challenges and future directions",artificial intelligence review,"megha bhushan, akkshat pandit, ayush garg","w2106956101, w2751634266, w2752747624","systematic literature reviews in software engineering – a systematic literature review, fcsr - fuzzy continuous speech recognition approach for identifying laryngeal pathologies using new weighted spectrum features, prediction of cardiovascular risk factors from retinal fundus photographs via deep learning","information and software technology, advances in intelligent systems and computing, nature biomedical engineering","barbara kitchenham, o. pearl brereton, david budgen, mark turner, john bailey, stephen linkman, rania m. ghoniem, khaled shaalan, ryan poplin, avinash v. varadarajan, katy blumer, yun liu, michael v. mcconnell, greg s. corrado, lily peng, dale r. webster"
w4367368475,impact of employee digital competence on the relationship between digital autonomy and innovative work behavior: a systematic review,artificial intelligence review,pham thanh huu,"w1961431544, w2012932483, w2145535121","a marketing communications approach for the digital era: managerial guidelines for social media integration, the prisma statement for reporting systematic reviews and meta-analyses of studies that evaluate health care interventions: explanation and elaboration, a comparison between two main academic literature collections: web of science and scopus databases","business horizons, annals of internal medicine, asian social science","ginger killian, kristy mcmanus, alessandro liberati, douglas g. altman, jennifer tetzlaff, cynthia d. mulrow, peter c gøtzsche, john p. a. ioannidis, mike clarke, p.j. devereaux, jos kleijnen, david moher, arezoo aghaei chadegani, hadi salehi, melor md yunus, hadi farhadi, masood fooladi, maryam farhadi, nader ale ebrahim"
w4367394292,non-player character decision-making in computer games,artificial intelligence review,"muhtar çağkan uludağlı, kaya oğuz","w1484225231, w1487104801, w1527144090","ai game programming wisdom, artificial intelligence for games, the state of the art in game ai standardisation","source not found, crc press ebooks, source not found","steve rabin, ian millington, john funge, billy yue, penny de-byl"
w4367394653,multiple criteria decision analytic methods in management with t-spherical fuzzy information,artificial intelligence review,ting‐yu chen,"w1980564456, w1983286635, w2079457935","intuitionistic fuzzy sets, picture fuzzy sets, pythagorean fuzzy subsets","fuzzy sets and systems, journal of computer science and cybernetics, source not found","krassimir atanassov, bùi công cường, ronald r. yager"
w4367609788,dimensionality reduced training by pruning and freezing parts of a deep neural network: a survey,artificial intelligence review,"paul wimmer, jens mehnert, alexandru paul condurache","w1625958017, w1677182931, w1993717606","deep neural networks with random gaussian weights: a universal classification strategy?, delving deep into rectifiers: surpassing human-level performance on imagenet classification, extreme learning machines: a survey","ieee transactions on signal processing, source not found, international journal of machine learning and cybernetics","raja giryes, guillermo sapiro, alex bronstein, kaiming he, xiangyu zhang, shaoqing ren, jian sun, guang-bin huang, dian hui wang, yuan lan"
w4367623968,a systematic review of the use of topic models for short text social media analysis,artificial intelligence review,"caitlin doogan, wray buntine, henry linger","w1517876957, w1532008752, w1916023682","the sage handbook of organizational research methods, information processing management, quantitative analysis of large amounts of journalistic texts using topic modelling","sage ebooks, source not found, digital journalism","david buchanan, alan bryman, ralph a. szweda, carina jacobi, wouter van atteveldt, kasper welbers"
w4368368712,optimal energy management in evcs and distribution system considering qos using hybrid technique,artificial intelligence review,"uma dharmalingam, vijayakumar arumugam","w1489385270, w1981173842, w2013230663","dispatch of ev charging station energy resources for sustainable mobility, integrated energy management of plug-in electric vehicles in power grid with renewables, electricity market equilibrium analysis based on nonlinear interior point algorithm with complementarity constraints","ieee transactions on transportation electrification, ieee transactions on vehicular technology, iet generation transmission & distribution","yung-tang liao, chan‐nan lu, shuang gao, k. t. chau, chunhua liu, diyun wu, c.c. chan, s. g. petoussis, xiaoping zhang, k.r. godfrey"
w4368617646,sar-bso meta-heuristic hybridization for feature selection and classification using dbnover stream data,artificial intelligence review,"dharani kumar talapula, kiran kumar ravulakollu, manoj kumar, adarsh kumar","w137929096, w2064630666, w2083022762","brain storm optimization algorithm, representational power of restricted boltzmann machines and deep belief networks, time series forecasting using a deep belief network with restricted boltzmann machines","lecture notes in computer science, neural computation, neurocomputing","yuhui shi, nicolas le roux, yoshua bengio, takashi kuremoto, shinsuke kimura, kunikazu kobayashi, masanao obayashi"
w4376616984,gift: granularity over specific-class for feature selection,artificial intelligence review,"jing ba, keyu liu, xibei yang, yuhua qian","w1021271351, w1545302199, w1976555061","a comparative study of multigranulation rough sets and concept lattices via rule acquisition, unknown title, an efficient rough feature selection algorithm with a multi-granulation view","knowledge-based systems, applied intelligence, international journal of approximate reasoning","jinhai li, yue ren, changlin mei, yuhua qian, xibei yang, igor kononenko, edvard šimec, marko robnik‐šikonja, jiye liang, feng wang, chuangyin dang, yuhua qian"
w4376648259,exploring the knowledge diffusion and research front of owa operator: a main path analysis,artificial intelligence review,"dejian yu, tianxing pan, zeshui xu, ronald r. yager","w1184279270, w1829951598, w1837958344","a scientometrics review on aggregation operator research, extension of topsis to multiple criteria decision making with pythagorean fuzzy sets, ordered weighted averaging operators 1988-2014: a citation-based literature survey","scientometrics, international journal of intelligent systems, international journal of intelligent systems","dejian yu, xiaolu zhang, zeshui xu, ali emrouznejad, marianna marra"
w4377098461,automatic path planning of unmanned combat aerial vehicle based on double-layer coding method with enhanced grey wolf optimizer,artificial intelligence review,"yingjuan jia, liangdong qu, xiaoqin li","w1444952417, w1509119367, w1593512478","binary grey wolf optimization approaches for feature selection, nonparametric statistical methods, an experimental study of benchmarking functions for genetic algorithms","neurocomputing, elsevier ebooks, source not found","e. emary, hossam m. zawbaa, aboul ella hassanien, klaas sijtsma, wilco h. m. emons, jason g. digalakis, konstantinos g. margaritis"
w4377145631,advanced value iteration for discrete-time intelligent critic control: a survey,artificial intelligence review,"mingming zhao, ding wang, junfei qiao, mingming ha, jin ren","w1680219837, w1854776945, w1969959431","value and policy iterations in optimal control and adaptive dynamic programming, handbook of learning and approximate dynamic programming, actor–critic-based optimal tracking for partially unknown nonlinear discrete-time systems","ieee transactions on neural networks and learning systems, ieee ebooks, ieee transactions on neural networks and learning systems","dimitri p. bertsekas, jennie si, andrew g. barto, warren b. powell, don wunsch, bahare kiumarsi, frank l. lewis"
w4377290775,nmode: neural memory ordinary differential equation,artificial intelligence review,yi zhang,"w1618067369, w1985940938, w2039133703","attractors in memory, a quantitative description of membrane current and its application to conduction and excitation in nerve, recurrent neural networks","science, the journal of physiology, scholarpedia","bruno poucet, étienne save, a. l. hodgkin, a. f. huxley, stephen grossberg"
w4378416796,a brief survey on recent advances in coreference resolution,artificial intelligence review,"ruicheng liu, rui mao, anh tuan luu, erik cambria","w189276277, w1965693266, w2005814556","pronoun resolution, a model-theoretic coreference scoring scheme, understanding natural language","studies in corpus linguistics, source not found, cognitive psychology","ruslan mitkov, marc vilain, john d. burger, john aberdeen, dennis connolly, lynette hirschman, terry winograd"
w4378807643,an adaptive spatio-temporal neural network for pm2.5 concentration forecasting,artificial intelligence review,"xiaoxia zhang, qixiong li, dong liang","w1966546000, w2002570697, w2046301883","artificial neural network (ann) for multi-source pm2.5 estimation using surface, modis, and meteorological data, estimates of global terrestrial isoprene emissions using megan (model of emissions of gases and aerosols from nature), recent progress in cfd modelling of wind field and pollutant transport in street canyons","source not found, atmospheric chemistry and physics, atmospheric environment","ling yao, ning lu, s. jiang, alex guenther, thomas karl, p. c. harley, christine wiedinmyer, paul i. palmer, chris geron, xian‐xiang li, chein‐shan liu, dennis y.c. leung, k. m. lam"
w4379137572,development of artificial neural network based mathematical models for predicting small scale quarry powder factor for efficient fragmentation coupled with uniformity index model,artificial intelligence review,"blessing olamide taiwo, yewuhalashet fissha, lateef bankole adamolekun, ogunyemi olaoluwa bidemi, oluwaseun victor famobuwa, adediran oluwatomisin victoria","w1983136748, w1990370241, w1996980189","burden prediction in blasting operation using rock geomechanical properties, energy components in rock blasting, evaluation and prediction of blast-induced ground vibration at shur river dam, iran, by artificial neural network","arabian journal of geosciences, international journal of rock mechanics and mining sciences, neural computing and applications","mohammad rezaei, masoud monjezi, saeed ghorbani moghaddam, farhad farzaneh, josé a. sanchidrián, pablo segarra, lina m. lópez, masoud monjezi, mahdi hasanipanah, manoj khandelwal"
w4379184928,image embedding for denoising generative models,artificial intelligence review,"andrea asperti, davide evangelista, samuele marro, fabio merizzi","w1834627138, w1901129140, w2519536754","deep learning face attributes in the wild, u-net: convolutional networks for biomedical image segmentation, generative visual manipulation on the natural image manifold","source not found, lecture notes in computer science, lecture notes in computer science","ziwei liu, ping luo, wei wang, xiaoou tang, olaf ronneberger, philipp fischer, thomas brox, jun-yan zhu, philipp krähenbühl, eli shechtman, alexei a. efros"
w4379209201,failure mode and effect analysis approach considering risk attitude of dynamic reference point cumulative prospect theory in uncertainty contexts,artificial intelligence review,"ying li, пэйдэ лю, xiaoming wu","w1975977312, w1987454296, w1995423287","generalized ordered weighted utility averaging-hyperbolic absolute risk aversion operators and their applications to group decision-making, induced 2-tuple linguistic generalized aggregation operators and their application in decision-making, fuzzy logic prioritization of failures in a system failure mode, effects and criticality analysis","european journal of operational research, information sciences, reliability engineering & system safety","jianwei gao, ming li, huihui liu, josé m. merigó, anna m. gil‐lafuente, j.b. bowles, enrique peláez"
w4379364212,deepthink iot: the strength of deep learning in internet of things,artificial intelligence review,"divyansh thakur, jaspal kaur saini, srikant srinivasan","w107619411, w1625518883, w1689711448","kullback-leibler divergence, the mcculloch-pitts model, lstm: a search space odyssey","springer ebooks, source not found, ieee transactions on neural networks and learning systems","james m. joyce, suzanne r. hayman, klaus greff, rupesh k. srivastava, jan koutník, bas r. steunebrink, jürgen schmidhuber"
w4379519548,uncertainty measurement of partially labeled categorical data with application to semi-supervised attribute reduction,artificial intelligence review,"pei wang, qinli zhang, witold pedrycz, zhaowen li, ching‐feng wen","w1965147513, w1988881859, w2007810691","fusion of local normalization and gabor entropy weighted features for face identification, semisupervised feature selection via spline regression for video semantic recognition, an uncertainty measure for incomplete decision tables and its applications","pattern recognition, ieee transactions on neural networks and learning systems, ieee transactions on cybernetics","leonardo cament, luis e. castillo, juan p. perez, francisco j. galdames, carlos a. perez, yahong han, yi yang, yan yan, zhigang ma, nicu sebe, xiaofang zhou, jianhua dai, wentao wang, qing xu"
w4379799065,a review on big data based on deep neural network approaches,artificial intelligence review,"m rithani, r prasanna kumar, srinath doss","w1543768025, w1861492603, w2029604816","comparing business intelligence and big data skills, microsoft coco: common objects in context, an overview of the global historical climatology network-daily database","business & information systems engineering, lecture notes in computer science, journal of atmospheric and oceanic technology","stefan debortoli, oliver müller, jan vom brocke, tsung-yi lin, michael maire, serge belongie, james hays, pietro perona, deva ramanan, piotr dollár, c. lawrence zitnick, matthew j. menne, imke durre, russell s. vose, byron e. gleason, tamara g. houston"
w4379876307,a large-scale multi-objective evolutionary algorithm based on importance rankings and information feedback,artificial intelligence review,"jie cao, kaiyue guo, jianlin zhang, zuohan chen","w1670967200, w1971537182, w1977627943","a multioperator search strategy based on cheap surrogate models for evolutionary optimization, use of cooperative coevolution for solving large scale multiobjective optimization problems, bare bones artificial bee colony algorithm with parameter adaptation and fitness-based neighborhood","ieee transactions on evolutionary computation, source not found, information sciences","wenyin gong, aimin zhou, zhihua cai, luis miguel antonio, carlos a. coello coello, weifeng gao, felix t.s. chan, lingling huang, sanyang liu"
w4380360151,a fraction ranking-based multi-criteria decision-making method for water resource management under bipolar neutrosophic fuzzy environment,artificial intelligence review,"totan garai, harish garg, george biswas","w1596345361, w1652191876, w1964787811","unknown title, sustainable water resource management under hydrological uncertainty, dss application to the development of water management strategies in ribeiras do algarve river basin","water resources management, water resources research, water resources management","k. srujan raju, lucien duckstein, cécile arondel, newsha ajami, george m. hornberger, david l. sunding, rodrigo maia, andreas schumann"
w4380538220,intelligent techniques in e-learning: a literature review,artificial intelligence review,"miloš ilić, vladimir mikić, lazar kopanja, boban vesin","w102779634, w1120211608, w11735708","ingrid: a web service tool for hierarchical open learner model visualization, personalising learning: exploring student and teacher perceptions about flexible learning and assessment in a flipped university course, investigating the effect of meta-cognitive scaffolding for learning by teaching","lecture notes in computer science, computers & education, lecture notes in computer science","ricardo conejo, mónica trella, iván cruces, rafael garcía, thomas wanner, edward palmer, noboru matsuda, cassondra l. griger, nikolaos barbalios, gabriel j. stylianides, william w. cohen, kenneth r. koedinger"
w4380562659,optimisation of electrical impedance tomography image reconstruction error using heuristic algorithms,artificial intelligence review,"talha ahmed khan, sai ho ling, arslan a. rizvi","w2041556066, w2068772918, w2096508655","uses and abuses of eidors: an extensible software base for eit, real-time 3d electrical impedance imaging for ventilation monitoring of the lung: pilot study, a bayesian approach and total variation priors in 3d electrical impedance tomography","physiological measurement, source not found, source not found","andy adler, william lionheart, bruce amm, tzu‐jen kao, xin wang, gregory boverman, david shoudy, james sabatini, jeffrey ashe, j.c. newell, g.j. saulnier, david isaacson, david davenport, ville kolehmainen, erkki somersalo, p j vauhkonen, marko vauhkonen, jari p. kaipio"
w4380591126,systematic study on deep learning-based plant disease detection or classification,artificial intelligence review,"c. k. sunil, c. d. jaidhar, nagamma patil","w1536680647, w2081544115, w2102605133","fast r-cnn, plant disease detection based on data fusion of hyper-spectral and multi-spectral fluorescence imaging using kohonen maps, rich feature hierarchies for accurate object detection and semantic segmentation","source not found, real-time imaging, source not found","ross girshick, dimitrios moshou, c. bravo, r. oberti, jonathan west, l. bodria, alastair mccartney, herman ramón, ross girshick, jeff donahue, trevor darrell, jitendra malik"
w4380611437,efficient data interpretation and artificial intelligence enabled iot based smart sensing system,artificial intelligence review,achyut shankar,"w2789554261, w2898083608, w2900427346","underwater optical wireless communications, networking, and localization: a survey, protocol stack of underwater wireless sensor network: classical approaches and new trends, terrain‐aided navigation for long‐endurance and deep‐rated autonomous underwater vehicles","ad hoc networks, wireless personal communications, journal of field robotics","nasir saeed, abdulkadir çelik, tareq y. al-naffouri, mohamed‐slim alouini, nitin goyal, mayank dave, anil kumar verma, georgios salavasidis, andrea munafò, catherine a. harris, thomas prampart, robert templeton, micheal smart, daniel roper, miles pebody, stephen mcphail, eric rogers, alexander b. phillips"
w4380762893,"granular reduction in formal fuzzy contexts: graph representation, graph approach and its algorithm",artificial intelligence review,"zengtai gong, jing zhang","w1484040084, w1826636392, w1964660346","graph theory with applications, what is a fuzzy concept lattice? ii, rule acquisition and complexity reduction in formal decision contexts","source not found, lecture notes in computer science, international journal of approximate reasoning","j. a. bondy, u. s. r. murty, radim bělohlávek, mingwen shao, yee leung, wei-zhi wu"
w4380887019,a systematic review of applications of natural language processing and future challenges with special emphasis in text-based emotion detection,artificial intelligence review,"sheetal kusal, shruti patil, jyoti choudrie, ketan kotecha, deepali vora, ilias o. pappas","w1489003673, w1501448404, w1509901816","yahoo! for amazon: sentiment parsing from small talk on the web, emotionfinder: detecting emotion from blogs and textual documents, emotion estimation and reasoning based on affective textual interaction","ssrn electronic journal, source not found, lecture notes in computer science","sanjiv ranjan das, mike y. chen, shiv naresh shivhare, shakun garg, anitesh mishra, chunling ma, helmut prendinger, mitsuru ishizuka"
w4381053565,a comprehensive survey on nsga-ii for multi-objective optimization and applications,artificial intelligence review,"haiping ma, yajing zhang, shengyi sun, ting liu, shan yu","w1497620262, w1571992030, w1588375755","anfis-based non-dominated sorting genetic algorithm ii for scenario-based joint energy and reserves market clearing considering tcsc device, environmental and economic power dispatch of thermal generators using modified nsga-ii algorithm, indicator-based selection in multiobjective search","international transactions on electrical energy systems, international transactions on electrical energy systems, lecture notes in computer science","iman goroohi sardou, mohammad taghi ameli, rajkumar muthuswamy, k. mahadevan, s. kannan, s. baskar, eckart zitzler, simon künzli"
w4381087276,transition of traditional method to deep learning based computer-aided system for breast cancer using automated breast ultrasound system (abus) images: a review,artificial intelligence review,"d. mohamad, syamsiah mashohor, rozi mahmud, marsyita hanafi, norafida bahari","w1812394418, w1901129140, w1903029394","segmentation and image analysis of abnormal lungs at ct: current approaches, challenges, and future trends, u-net: convolutional networks for biomedical image segmentation, fully convolutional networks for semantic segmentation","radiographics, lecture notes in computer science, source not found","awais mansoor, ulaş bağcı, brent foster, ziyue xu, georgios z. papadakis, les folio, jayaram k. udupa, daniel j. mollura, olaf ronneberger, philipp fischer, thomas brox, jonathan long, evan shelhamer, trevor darrell"
w4381090279,scene text understanding: recapitulating the past decade,artificial intelligence review,"mridul ghosh, himadri mukherjee, sk md obaidullah, xiao‐zhi gao, kaushik roy","w117491841, w1488125194, w1521064364","robust scene text detection with convolution neural network induced mser trees, a method for text localization and recognition in real-world images, word spotting in the wild","lecture notes in computer science, lecture notes in computer science, lecture notes in computer science","weilin huang, yu qiao, xiaoou tang, lukáš neumann, jǐŕı matas, kai wang, serge belongie"
w4381093614,image data hiding schemes based on metaheuristic optimization: a review,artificial intelligence review,"anna melman, oleg evsutin","w12118277, w143073401, w1493698890","a review of bio-inspired algorithms as image processing techniques, bio-inspiring techniques in watermarking medical images: a review, attacks on copyright marking systems","communications in computer and information science, intelligent systems reference library, lecture notes in computer science","noor elaiza abdul khalid, norharyati md ariff, saadiah yahya, noorhayati mohamed noor, mona soliman, aboul ella hassanien, hoda m. onsi, fabien a. p. petitcolas, ross anderson, markus kuhn"
w4381163588,a review on the significance of body temperature interpretation for early infectious disease diagnosis,artificial intelligence review,"nurul izzati darul zaman, yuan wen hau, ming chern leong, rania hussien al-ashwal","w113173184, w1511538667, w1539953834","effects of sample size on accuracy and stability of species distribution models: a comparison of garp and maxent, temperature measurement in intensive care patients: comparison of urinary bladder, oesophageal, rectal, axillary, and inguinal methods versus pulmonary artery core method, artificial neural networks in biomedical engineering: a review","lecture notes in electrical engineering, intensive care medicine, elsevier ebooks","xinmei chen, yuancai lei, jean‐yves lefrant, laurent müller, j.-e. de la coussaye, mohammed benbabaali, c. lebris, n. zeitoun, cristina mari, g. saïssi, jacques ripart, jean‐jacques eledjam, richi nayak, lakhmi c. jain, bai ting"
w4381185442,an effective conflict management method based on belief similarity measure and entropy for multi-sensor data fusion,artificial intelligence review,zhe liu,"w1981643872, w1987812214, w1987869189","the combination of evidence in the transferable belief model, combining belief functions based on distance of evidence, measures of the amount of ecologic association between species","ieee transactions on pattern analysis and machine intelligence, decision support systems, ecology","p. smets, yong deng, shi wen-kang, zhu zhen-fu, qi liu, lee r. dice"
